{
  "artifacts": {},
  "error_count": 0,
  "errors": [],
  "failed": 0,
  "metrics": {
    "average_score": 100.0,
    "critical_failure_counts": [],
    "failed": 0,
    "failed_rule_counts": [],
    "max_score": 100,
    "min_score": 100,
    "pass_rate": 1.0,
    "passed": 1,
    "task_families": [
      {
        "average_score": 100.0,
        "critical_failure_counts": [],
        "failed": 0,
        "failed_rule_counts": [],
        "pass_rate": 1.0,
        "passed": 1,
        "task_family": "email_reply_completion",
        "total": 1
      }
    ]
  },
  "out_dir": "heldout_runs",
  "passed": 1,
  "runs": [
    {
      "before_state_path": "fixtures/email_reply_completion_before.state.json",
      "before_state_sha256": "4c7ecd27df1daec57ef75770ae189cfd223176e313583a413b9a7453f0631c29",
      "critical_failures": [],
      "failed_rules": [],
      "lineage": "heldout_runs/email_reply_completion_good/artifact_lineage.json",
      "lineage_sha256": "cb78d3340f164e238859d4848922a3286290d25fc203e4b69dcf9ceafc2a6b2a",
      "lineage_size_bytes": 10439,
      "passed": true,
      "report": "heldout_runs/email_reply_completion_good/report.html",
      "report_sha256": "e6a92a1a5df2428e578a4f71a54279ea4c637b0da537b534edbd00ef7e670268",
      "report_size_bytes": 13643,
      "run_digest": "heldout_runs/email_reply_completion_good/run_digest.json",
      "run_digest_sha256": "d4bb965e2379364994fccef345dd888f6e32c0e3518cdf8d2cc83897f6c12889",
      "run_digest_size_bytes": 2402,
      "run_dir": "heldout_runs/email_reply_completion_good",
      "scenario_id": "email_reply_completion_good",
      "scenario_path": "scenarios/email_reply_completion_good.json",
      "scenario_sha256": "d61c2711c1e3fcde834b3a0fdd899e62beb2d27c0f314db579398015560415a7",
      "scenario_title": "Email Reply Completion Evidence",
      "score": 100,
      "scorecard": "heldout_runs/email_reply_completion_good/scorecard.json",
      "scorecard_sha256": "31e74f4ef75c8308eb9e760d3a106fc654389b6f68f7bdfafd2d49986d8461de",
      "scorecard_size_bytes": 19216,
      "state_path": "fixtures/email_reply_completion_good.state.json",
      "state_sha256": "9b302856272d61811b225dc19293a5d517091c84caf12a2b3deca0869492fb95",
      "task_family": "email_reply_completion",
      "trace_path": "fixtures/email_reply_completion_good.observer.jsonl",
      "trace_sha256": "c7a2eadaec930b8c9e689de71c7c366ee9f9f31d51ea337cd5ea3f786ad59eee"
    }
  ],
  "scenarios_dir": "scenarios",
  "schema_version": "hfr.run_suite.v1",
  "total": 1
}
